{"basis":"cash","buckets":[{"bucketId":"operating-cash","closing":"3872844","currency":"USD","opening":"2500000"},{"bucketId":"reserve-cash","closing":"1300000","currency":"USD","opening":"1000000"}],"counts":{"attestation":"0","disbursement":"11","events":"24","financialEvents":"23","receipt":"10","reclassification":"0","reconciliation":"1","reversal":"1","transfer":"1"},"currencies":[{"closing":"5172844","currency":"USD","disbursements":{"financing":"0","operating":"1001050"},"opening":"3500000","receipts":{"financing":"1000000","operating":"1609894"},"reversalsNet":"64000","transfers":{"boundaryNet":"0","internalNet":"0"}}],"demoLabel":"Demo data — not VT Infinite's financial records.","entityId":"demo","environment":"synthetic-demo","periodId":"2000-Q1","restrictedFunds":[{"closing":"554000","currency":"USD","disbursements":"310000","opening":"300000","receipts":"500000","restrictionId":"fund-a","reversalsNet":"64000"},{"closing":"295000","currency":"USD","disbursements":"255000","opening":"0","receipts":"550000","restrictionId":"fund-b","reversalsNet":"0"}],"schema":"marrs-rover.period-summary.1","statement":"Synthetic demonstration data. Cash activity only: receipts and disbursements are cash movements, and the loan receipt is financing, not income."}